{
  "schema_version": "candidate-payload-facets-v0",
  "domain": "career_private",
  "experience_intent": "company_experience",
  "subject": {
    "type": "company",
    "public_name": "Example Inc",
    "aliases": []
  },
  "claim_type": "subjective_impression",
  "evidence_strength": "single_observation",
  "sensitivity": "medium",
  "retrieval_policy": "explicit_or_contextual",
  "source_policy": {
    "raw_source_retention": "none",
    "publication_eligible": false,
    "ingest_enablement": "disabled_until_gate"
  }
}
